{
  "schema_version": 2,
  "case_id": "too-many-candidates-refused-explicitly",
  "description": "Exceeding the unique-candidate cap is an explicit refusal, not an order-dependent partial verification.",
  "tags": [
    "resource-bound",
    "adversarial"
  ],
  "evaluation_time": 100,
  "policy": {
    "policy_id": "candidate-cap",
    "version": 1,
    "max_signature_observations": 128,
    "max_signature_candidates": 1,
    "algorithm_registry": [
      {
        "algorithm": "ed25519",
        "family": "elliptic_curve",
        "assurance_class": "classical"
      }
    ],
    "group_definitions": [
      {
        "group": "classical",
        "predicate": {
          "allowed_assurance_classes": [
            "classical"
          ]
        }
      }
    ],
    "accept_if_any": [
      {
        "clause_id": "required",
        "required_groups": [
          {
            "group": "classical",
            "min_distinct_identities": 1
          }
        ],
        "relations": []
      }
    ],
    "epoch": 1,
    "previous_policy_hash": null,
    "active_from": null,
    "expires_at": null,
    "family_registry": [
      {
        "family": "elliptic_curve",
        "status": "enabled"
      }
    ]
  },
  "trusted_keys": [
    {
      "key_id": "ed-a",
      "key_name": "cache-a",
      "signer_identity": "owner-a",
      "algorithm": "ed25519",
      "roles": [
        "cache-signing"
      ],
      "authority": "owner-a",
      "custody_domain": "ed-a"
    }
  ],
  "input": {
    "adapter": "semantic",
    "signatures": [
      {
        "key_id": "ed-a",
        "signature_id": "sig-a",
        "verification": "valid"
      },
      {
        "key_id": "ed-a",
        "signature_id": "sig-b",
        "verification": "valid"
      }
    ]
  },
  "expected": {
    "decision": "refuse",
    "required_reason_codes": [
      "too_many_candidates"
    ],
    "forbidden_reason_codes": [
      "missing_required_group"
    ],
    "group_counts": {}
  },
  "minimum_policy_epoch": 0
}
