{
  "schema_version": 2,
  "case_id": "expired-legacy-migration-clause-refused",
  "description": "A classical fallback clause stops authorizing after its explicit migration boundary.",
  "tags": [
    "migration",
    "expiry",
    "downgrade"
  ],
  "evaluation_time": 200,
  "policy": {
    "policy_id": "migration-window",
    "version": 1,
    "max_signature_observations": 128,
    "max_signature_candidates": 32,
    "algorithm_registry": [
      {
        "algorithm": "ed25519",
        "family": "elliptic_curve",
        "assurance_class": "classical"
      },
      {
        "algorithm": "ml-dsa-65",
        "family": "lattice",
        "assurance_class": "post_quantum"
      }
    ],
    "group_definitions": [
      {
        "group": "legacy-classical",
        "predicate": {
          "allowed_assurance_classes": [
            "classical"
          ],
          "required_roles": [
            "legacy-cache-signing"
          ]
        }
      },
      {
        "group": "classical",
        "predicate": {
          "allowed_assurance_classes": [
            "classical"
          ]
        }
      },
      {
        "group": "post-quantum",
        "predicate": {
          "allowed_assurance_classes": [
            "post_quantum"
          ]
        }
      }
    ],
    "accept_if_any": [
      {
        "clause_id": "legacy-window",
        "required_groups": [
          {
            "group": "legacy-classical",
            "min_distinct_identities": 1
          }
        ],
        "relations": [],
        "active_until": 200
      },
      {
        "clause_id": "hybrid-target",
        "required_groups": [
          {
            "group": "classical",
            "min_distinct_identities": 1
          },
          {
            "group": "post-quantum",
            "min_distinct_identities": 1
          }
        ],
        "relations": [
          {
            "relation_id": "same-signer-identity",
            "attribute": "identity",
            "mode": "same",
            "groups": [
              "classical",
              "post-quantum"
            ]
          }
        ],
        "active_from": 0
      }
    ],
    "epoch": 1,
    "previous_policy_hash": null,
    "active_from": null,
    "expires_at": null,
    "family_registry": [
      {
        "family": "elliptic_curve",
        "status": "enabled"
      },
      {
        "family": "lattice",
        "status": "enabled"
      }
    ]
  },
  "trusted_keys": [
    {
      "key_id": "legacy-ed",
      "key_name": "legacy-cache",
      "signer_identity": "legacy-owner",
      "algorithm": "ed25519",
      "roles": [
        "legacy-cache-signing"
      ],
      "authority": "legacy-owner",
      "custody_domain": "legacy-ed"
    },
    {
      "key_id": "cache-ed",
      "key_name": "cache",
      "signer_identity": "cache-owner",
      "algorithm": "ed25519",
      "roles": [
        "cache-signing"
      ],
      "authority": "cache-owner",
      "custody_domain": "cache-ed"
    },
    {
      "key_id": "cache-pq",
      "key_name": "cache",
      "signer_identity": "cache-owner",
      "algorithm": "ml-dsa-65",
      "roles": [
        "cache-signing"
      ],
      "authority": "cache-owner",
      "custody_domain": "cache-pq"
    }
  ],
  "input": {
    "adapter": "semantic",
    "signatures": [
      {
        "key_id": "legacy-ed",
        "signature_id": "legacy-good",
        "verification": "valid"
      }
    ]
  },
  "expected": {
    "decision": "refuse",
    "required_reason_codes": [
      "missing_required_group"
    ],
    "forbidden_reason_codes": [],
    "group_counts": {
      "classical": 1,
      "post-quantum": 0
    }
  },
  "minimum_policy_epoch": 0
}
